{"$schema":"https://json-schema.org/draft/2020-12/schema","$id":"https://github.com/epi13/mncs-fabric/schemas/job-plan-v0.1.schema.json","title":"MNCS Fabric Job Plan 0.1","type":"object","additionalProperties":false,"required":["schema_version","job_id","candidate_identity","artifact_manifest_identity","argv","working_directory","timeout_seconds","output_limit_bytes","environment","required_capabilities","result_paths","network_policy"],"properties":{"schema_version":{"const":"mncs-fabric.job-plan.v0.1"},"job_id":{"type":"string","minLength":1,"maxLength":200},"candidate_identity":{"type":"string","pattern":"^sha256:[0-9a-f]{64}$"},"evaluator_identity":{"oneOf":[{"type":"string","pattern":"^sha256:[0-9a-f]{64}$"},{"type":"null"}]},"artifact_manifest_identity":{"type":"string","pattern":"^sha256:[0-9a-f]{64}$"},"argv":{"type":"array","minItems":1,"items":{"type":"string","minLength":1}},"working_directory":{"type":"string","minLength":1},"timeout_seconds":{"type":"number","minimum":0.05,"maximum":86400},"output_limit_bytes":{"type":"integer","minimum":1,"maximum":67108864},"environment":{"type":"object","maxProperties":64,"additionalProperties":{"type":"string","maxLength":8192}},"required_capabilities":{"type":"array","uniqueItems":true,"items":{"type":"string","minLength":1}},"result_paths":{"type":"array","uniqueItems":true,"items":{"type":"string","minLength":1}},"network_policy":{"enum":["UNSPECIFIED","DECLARED_OFFLINE","UNRESTRICTED"]},"job_identity":{"type":"string","pattern":"^sha256:[0-9a-f]{64}$"}}}
