{"argv":["@python","task.py"],"artifact_manifest_identity":"sha256:b030e36d524a2e7c2201c5972e59860477822aeaaf5d16654e52a8292c461857","candidate_identity":"sha256:65e0e98a48fc207f9955a71232c72c1e93e8d939e90c18bd8dbfd23b31dba33d","environment":{"PYTHONHASHSEED":"0"},"evaluator_identity":null,"job_id":"example:portable-python:0.1","network_policy":"DECLARED_OFFLINE","output_limit_bytes":65536,"required_capabilities":["python"],"result_paths":["result.json"],"schema_version":"mncs-fabric.job-plan.v0.1","timeout_seconds":10,"working_directory":"."}
